{"reportVersion":1,"kind":"selected-text-operational-acceptance","evidenceSha256":"b399931d77b43e3131dc77566b3394a16307319527b7b0ad182f7491506e7b8c","corpusSha256":"2f574e01cff6a1438a0ba312315c91f0214b9db501965d93234552d02bab8b07","models":{"primary":{"modelId":"qwen3-8b-q4-k-m","artifactSha256":"d98cdcbd03e17ce47681435b5150e34c1417f50b5c0019dd560e4882c5745785","runtimeVersion":"llama-cpp-python-0.3.34","deviceName":"AMD Radeon RX 6600 XT (RADV NAVI23)","fullyOffloadedLayers":37},"hebrewTranslation":{"modelId":"dictalm2-hebrew-q4-k-m","artifactSha256":"dc53cc29a30444677a7760af31f807a61999477c526cdbe6552803259a94c735","runtimeVersion":"llama-cpp-python-0.3.34","deviceName":"AMD Radeon RX 6600 XT (RADV NAVI23)","fullyOffloadedLayers":33}},"metrics":{"operationTermRecall":0.9230769230769231,"taskTermRecall":1.0,"targetScriptIntegrity":1.0,"promptInjectionIntegrity":1.0,"providerRouteIntegrity":1.0,"p95LatencyMs":18048,"cancellationLatencyMs":802},"safety":{"privateFragmentsDiscarded":true,"defaultRoutePreserved":true},"qualified":true,"scope":{"accelerator":"gpu","cpuFallback":"forbidden","hebrewRoute":"explicit-translation-target-only","otherLanguages":"qwen-primary-route","arbitrarySelections":"not-claimed"}}
